Date,Filename,Title,Download Url,Threat Actor,Victim Country,Zero-Day,Attack Vector,Malware,Target Sector
2018-08-16,cta-2018-0816,,https://github.com/CyberMonitor/APT_CyberCriminal_Campagin_Collections/raw/master/2018/2018.08.16.Chinese_Cyberespionage_Tsinghua_University/cta-2018-0816.pdf,"APT10, APT17","Kenya, Mongolia, Brazil, and Alaska.",Not mentioned,Not mentioned,ext4 backdoor,"Corporations and Businesses, Cloud/IoT services, Manufacturing, Education and research institutions."
2018-08-23,Operation_AppleJeus,,https://github.com/CyberMonitor/APT_CyberCriminal_Campagin_Collections/raw/master/2018/2018.08.23.Operation_AppleJeus/Operation_AppleJeus.pdf,Lazarus APT group,Not mentioned,Not mentioned,Not mentioned,"Fallchill, Updater.exe, Cellas Trading Pro suite, macOS malware",Financial institutions
2018-08-29,Appendix-TheUrpageConnectiontoBahamutConfuciusandPatchwork,,https://github.com/CyberMonitor/APT_CyberCriminal_Campagin_Collections/raw/master/2018/2018.08.29.Bahamut_Confucius_Patchwork/Appendix-TheUrpageConnectiontoBahamutConfuciusandPatchwork.pdf,Not mentioned,Not mentioned.,Not mentioned,Malicious Documents,"TSPY_DELF.BFJ, BKDR_DELF.XXVR, AndroidOS_Bahamut.HRX, AndroidOS_Bahamut.HRXB, TROJ_DELF.XXXK, Mal_OtorunN, VBS_DELF.PTR, Delphi, VB.",Not mentioned
2018-09-04,oilrig-targets-middle-eastern-government-adds-evasion-techniques-oopsie,,https://github.com/CyberMonitor/APT_CyberCriminal_Campagin_Collections/raw/master/2018/2018.09.04.OilRig_Targets_Middle_Eastern/oilrig-targets-middle-eastern-government-adds-evasion-techniques-oopsie.pdf,OilRig group,Not mentioned,Not mentioned,"SpearPhishing, Social Engineering, Malicious Documents","OopsIE, QUADAGENT",Government and defense agencies
2018-09-10,LuckyMouse,,https://github.com/CyberMonitor/APT_CyberCriminal_Campagin_Collections/raw/master/2018/2018.09.10.LuckyMouse/LuckyMouse.pdf,LuckyMouse actor,Middle Asian governments' entities.,Not mentioned,Not mentioned,"Trojan (C++ last stage RAT), Earthworm tunneler, NDISProxy, Metasploit, CobaltStrike, Scanline network scanner, Blackbone, Http-parser, Microsoft Windows Driver Kit (WDK) sample code.",Government and defense agencies
2018-09-19,20180919,,https://github.com/CyberMonitor/APT_CyberCriminal_Campagin_Collections/raw/master/2018/2018.09.19.Green_Spot_APT/20180919.pdf,绿斑 (GreenSpot),China,Not mentioned,"SpearPhishing, Malicious Documents, Exploit Vulnerability, Social Engineering.","Trojan[Exploit]/MSWord.CVE-2012-0158, Trojan[Backdoor]/Win32.Gh0st, Trojan/Win32.Agent, Trojan[Backdoor]/Win32.HttpBots, Trojan[Backdoor]/Win32.Poison, Poison Ivy RAT, ZXShell.",Government and defense agencies.
2018-10-11,Gallmaker New Attack Group Eschews Malware to Live off the Land,,https://github.com/CyberMonitor/APT_CyberCriminal_Campagin_Collections/raw/master/2018/2018.10.11.Gallmaker/Gallmaker%20New%20Attack%20Group%20Eschews%20Malware%20to%20Live%20off%20the%20Land.pdf,Gallmaker,"Bulgaria, Romania, and Brazil.",FALSE,"SpearPhishing, Malicious Documents, Exploit Vulnerability","WindowsRoamingToolsTask, Metasploit (reverse_tcp payload, msfvenom), WinZip console, Rex PowerShell library, Microsoft Office Dynamic Data Exchange (DDE) protocol.",Government and defense agencies
2018-10-17,ESET_GreyEnergy,,https://github.com/CyberMonitor/APT_CyberCriminal_Campagin_Collections/raw/master/2018/2018.10.17.GreyEnergy/ESET_GreyEnergy.pdf,GreyEnergy group,"Ukraine, Poland, and other critical infrastructure organizations in Central and Eastern Europe.",Not mentioned,"Exploit Vulnerability, SpearPhishing, Malicious Documents","GreyEnergy, BlackEnergy, KillDisk, NotPetya, BadRabbit, GreyEnergy mini, Nmap, Mimikatz, Moonraker Petya, Green Petya.","Critical infrastructure, Energy and utilities, Corporations and Businesses, Manufacturing, Individuals."
2018-10-17,MartyMcFly Malware_ Targeting Naval Industry,,https://github.com/CyberMonitor/APT_CyberCriminal_Campagin_Collections/raw/master/2018/2018.10.17_MartyMcFly_Targeting_Naval_Industry/MartyMcFly%20Malware_%20Targeting%20Naval%20Industry.pdf,Not mentioned,Not mentioned,Not mentioned,"SpearPhishing, Social Engineering, Malicious Documents","MartyMcFly Malware, GEqy87.exe, Borland Delphi 7.",Government and defense agencies
2018-10-18,Tracking Tick Through Recent Campaigns Targeting East Asia,,https://github.com/CyberMonitor/APT_CyberCriminal_Campagin_Collections/raw/master/2018/2018.10.18.Datper_Bronze_Butler/Tracking%20Tick%20Through%20Recent%20Campaigns%20Targeting%20East%20Asia.pdf,"Tick, Redbaldknight, Bronze Butler",South Korea and Japan,Not mentioned,"Drive-by Download, Watering Hole","Datper, xxmm backdoor, Murim, Wrim, Emdivi, shadowWalker, BypassUacDll, loadSetup, xxmm2, test2, xxmm3, ReflectivLoader.",Not mentioned
2018-10-19,DarkPulsar,,https://github.com/CyberMonitor/APT_CyberCriminal_Campagin_Collections/raw/master/2018/2018.10.19.DarkPulsar/DarkPulsar.pdf,Not mentioned,"Russia, Iran, and Egypt.",Not mentioned,Not mentioned,"FuzzBunch, DanderSpritz, DarkPulsar, EDFStagedUpload, PeddleCheap, PcDllLauncher, sipauth32.tsp","Energy and utilities, Critical infrastructure, Corporations and Businesses, Education and research institutions."
2018-11-01,Perl-Based Shellbot Looks to Target Organizations via C&C - TrendLabs Security Intelligence Blog,,https://github.com/CyberMonitor/APT_CyberCriminal_Campagin_Collections/raw/master/2018/2018.11.01_Outlaw_group/Perl-Based%20Shellbot%20Looks%20to%20Target%20Organizations%20via%20C%26C%20-%20TrendLabs%20Security%20Intelligence%20Blog.pdf,Outlaw,"Taiwan, Japan, United States, India, United Kingdom, Israel, Kuwait, Brazil, Colombia, Germany, Switzerland, Thailand, Bulgaria, Greece, Italy, Malaysia.",Not mentioned,"Exploit Vulnerability, Credential Reuse","Perl-Based Shellbot, Shellbot, Haiduc, wget, curl, tar, perl interpreter, PERL_SHELLBOT.SM.","Government and defense agencies, Corporations and Businesses, Education and research institutions."
2018-11-05,Inception Attackers Target Europe with Year-old Office Vulnerability,,https://github.com/CyberMonitor/APT_CyberCriminal_Campagin_Collections/raw/master/2018/2018.11.05.Inception_Attackers_Target_Europe/Inception%20Attackers%20Target%20Europe%20with%20Year-old%20Office%20Vulnerability.pdf,Inception Attackers,"Europe, Russia, and Central Asia.",FALSE,"SpearPhishing, Malicious Documents, Exploit Vulnerability","POWERSHOWER, VBScript",Government and defense agencies
2018-11-08,FASTCash How the Lazarus Group is Emptying Millions from ATMs,,https://github.com/CyberMonitor/APT_CyberCriminal_Campagin_Collections/raw/master/2018/2018.11.08.FASTCash/FASTCash%20How%20the%20Lazarus%20Group%20is%20Emptying%20Millions%20from%20ATMs.pdf,"Lazarus, Hidden Cobra",Not mentioned,FALSE,Exploit Vulnerability,Trojan.Fastcash,"Financial institutions, Media and entertainment companies"
2018-11-20,blog.trendmicro.com-Lazarus Continues Heists Mounts Attacks on Financial Organizations in Latin America,,https://github.com/CyberMonitor/APT_CyberCriminal_Campagin_Collections/raw/master/2018/2018.11.20.lazarus-in-latin-america/blog.trendmicro.com-Lazarus%20Continues%20Heists%20Mounts%20Attacks%20on%20Financial%20Organizations%20in%20Latin%20America.pdf,Lazarus group,"Latin America, Asia, and Africa",Not mentioned,"Social Engineering, Phishing, Malicious Documents, Drive-by Download.","BKDR_BINLODR.ZNFJ-A, FileTokenBroker.dll, AuditCred.dll, ROptimizer.dll, Msadoz<n>.dll, BKDR64_BINLODR.ZNFJ-A, Auditcred.dll.mui, rOptimizer.dll.mui, TROJ_BINLODRCONF.ZNFJ-A",Financial institutions
2018-11-28,MuddyWater-Operations-in-Lebanon-and-Oman,,https://github.com/CyberMonitor/APT_CyberCriminal_Campagin_Collections/raw/master/2018/2018.11.28.MuddyWater-Operations-in-Lebanon-and-Oman/MuddyWater-Operations-in-Lebanon-and-Oman.pdf,MuddyWater,Lebanon and Oman,Not mentioned,"SpearPhishing, Malicious Documents, Social Engineering","ViperMonkey, POWERSTATS, PowerShell, WScript.exe, CScript.exe, schtasks.exe.","Government and defense agencies, Individuals."
2018-11-29,EN_version,,https://github.com/CyberMonitor/APT_CyberCriminal_Campagin_Collections/raw/master/2018/2018.11.29.Attack_Pakistan_By_Exploiting_InPage/EN_version.pdf,BITTER,"China, Pakistan, South Asia, Middle East.",Not mentioned,"SpearPhishing, Social Engineering, Exploit Vulnerability, Malicious Documents.","Cobalt Strike, WSCSPL",Government and defense agencies
2018-11-30,PowerShell-based Backdoor Found in Turkey Strikingly Similar to MuddyWater Tools,,https://github.com/CyberMonitor/APT_CyberCriminal_Campagin_Collections/raw/master/2018/2018.11.30.MuddyWater_Turkey/PowerShell-based%20Backdoor%20Found%20in%20Turkey%20Strikingly%20Similar%20to%20MuddyWater%20Tools.pdf,MuddyWater,Turkey,Not mentioned,"SpearPhishing, Phishing, Social Engineering, Malicious Documents","W2KM_POWRUN.A, Backdoor.Win32.POWRUN.AA, BKDR_POWRUN.B, Trojan.W97M.POWRUN.AA, BKDR_POWRUN.A, POWERSTATS, PowerShell, cmd.exe, reg.exe, rundll32, Invoke Expression (IEX).",Government and defense agencies
2018-12-13,Shamoon 3 Targets Oil and Gas Organization,,https://github.com/CyberMonitor/APT_CyberCriminal_Campagin_Collections/raw/master/2018/2018.12.13.Shamoon_3/Shamoon%203%20Targets%20Oil%20and%20Gas%20Organization.pdf,Not mentioned,Not mentioned,Not mentioned,Not mentioned,"Disttrack, communications module, wiper module, ElDos RawDisk Driver",Energy and utilities
2018-12-13,The Return of The Charming Kitten,,https://github.com/CyberMonitor/APT_CyberCriminal_Campagin_Collections/raw/master/2018/2018.12.13.Charming_Kitten_Return/The%20Return%20of%20The%20Charming%20Kitten.pdf,Charming Kitten,Israeli and American citizens,Not mentioned,"Phishing, SpearPhishing",Not mentioned,"Government and defense agencies, Corporations and Businesses, Financial institutions, Media and entertainment companies, Non-Governmental Organizations (NGOs) and Nonprofits, Individuals."
2018-12-13,tech-brief-tildeb-analyzing-the-18-year-old-implant-from-the-shadow-brokers-leak,,https://github.com/CyberMonitor/APT_CyberCriminal_Campagin_Collections/raw/master/2018/2018.12.13.Tildeb_Shadow_Brokers/tech-brief-tildeb-analyzing-the-18-year-old-implant-from-the-shadow-brokers-leak.pdf,Not mentioned,Not mentioned,TRUE,Not mentioned,"Tildeb, PATROLWAGON, UNITEDRAKE, MOSSFERN, EXPANDINGPULLY, GROK, FOGGYBOTTOM, MORBIDANGEL.",Not mentioned
2018-12-20,analyzing WindShift implant OSX.WindTail,,https://github.com/CyberMonitor/APT_CyberCriminal_Campagin_Collections/raw/master/2018/2018.12.20.WindShift_Middle_East/analyzing%20WindShift%20implant%20OSX.WindTail.pdf,WindShift APT group,Not mentioned.,Not mentioned,"Exploit Vulnerability, Social Engineering",OSX.WindTail.A,Not mentioned
2018-12-27,The Enigmatic Roma225 Campaign,,https://github.com/CyberMonitor/APT_CyberCriminal_Campagin_Collections/raw/master/2018/2018.12.27.Roma225_Campaign/The%20Enigmatic%20Roma225%20Campaign.pdf,The Gorgon Group,Not mentioned,Not mentioned,"SpearPhishing, Malicious Documents","RevengeRAT, njRAT, SendBlaster, Blogger, DuckDNS.",Corporations and Businesses
2019-01-15,2018_ A Year of Cyber Attacks - HACKMAGEDDON,,https://github.com/CyberMonitor/APT_CyberCriminal_Campagin_Collections/raw/master/Report/2019.01.15.2018-a-year-of-cyber-attacks/2018_%20A%20Year%20of%20Cyber%20Attacks%20%E2%80%93%20HACKMAGEDDON.pdf,Roaming Mantis,"Japan, Korea, Canada, Israel, United States.",Not mentioned.,"Credential Reuse, Exploit Vulnerability, Website Equipping","Pegasus, Coinhive, DanaBot, Hancitor, FakeSpy.","*   **Individuals:** Individuals, Canadian permanent resident and Saudi dissident Omar Abdulaziz, iOS Users.
*   **Government and defense agencies:** Public administration, defence, social security.
*   **Corporations and Businesses:** Multiple Industries, Information, communication, Wholesale, retail trade, Accommodation, food services, Other services, Transportation, Storage, Professional scientific, technical, Administrative and support services, Real estate, Apollo.
*   **Financial institutions:** Financial and insurance, Fintech, US Banks.
*   **Healthcare:** Human health, social work.
*   **Energy and utilities:** Electricity, gas steam, air conditioning supply, Water supply, sewerage waste management.
*   **Manufacturing:** Manufacturing.
*   **Education and research institutions:** Education.
*   **Media and entertainment companies:** Arts entertainment, recreation.
*   **Critical infrastructure:** Not mentioned.
*   **Non-Governmental Organizations (NGOs) and Nonprofits:** Extraterritorial organizations and bodies.
*   **Cloud/IoT services:** Not mentioned."
2019-01-16,darkhydruns-group-against-middle-east-en,,https://github.com/CyberMonitor/APT_CyberCriminal_Campagin_Collections/raw/master/2019/2019.01.16.DarkHydruns/darkhydruns-group-against-middle-east-en.pdf,DarkHydrus Group,Middle East,FALSE,Malicious Documents,"Dropper (Macros), 12-B-366.txt (HTA file), WINDOWSTEMP.ps1 (PowerShell script), OﬃceUpdateService.exe (Backdoor), regsvr32.exe, Excel, VBA macro, HTML application, PowerShell, C#",Government and defense agencies
2019-02-01,OceanLotus_KerrDown,,https://github.com/CyberMonitor/APT_CyberCriminal_Campagin_Collections/raw/master/2019/2019.02.01.OceanLotus_KerrDown/OceanLotus_KerrDown.pdf,OceanLotus (AKA APT32),"Vietnam, globally, and within the APAC region.",Not mentioned,Malicious Documents,"KerrDown, Cobalt Strike Beacon","Government and defense agencies, Corporations and Businesses, Individuals."
2019-02-14,suspected-molerats-new-attack-in-the-middle-east-cn,,https://github.com/CyberMonitor/APT_CyberCriminal_Campagin_Collections/raw/master/2019/2019.02.14.Molerats_APT/suspected-molerats-new-attack-in-the-middle-east-cn.pdf,Molerats APT organization,Not mentioned,FALSE,"SpearPhishing, Social Engineering, Malicious Documents.","wmsetup.vbs, ihelp.exe (Backdoor), Enigma Virtual Box",Government and defense agencies.
2019-02-25,Defeating Compiler-Level Obfuscations Used in APT10 Malware,,https://github.com/CyberMonitor/APT_CyberCriminal_Campagin_Collections/raw/master/2019/2019.02.25.APT10_Defeating_Compiler_Level/Defeating%20Compiler-Level%20Obfuscations%20Used%20in%20APT10%20Malware.pdf,APT10,Japan,Not mentioned,Not mentioned,"APT10 ANEL (UpperCut), Turla mosquito, Dharma ransomware packer",Not mentioned
2019-02-26,The Arsenal Behind the Australian Parliament Hack,,https://github.com/CyberMonitor/APT_CyberCriminal_Campagin_Collections/raw/master/2019/2019.02.26.Australian_Parliament_Hack/The%20Arsenal%20Behind%20the%20Australian%20Parliament%20Hack.pdf,Not mentioned,Not mentioned,FALSE,Not mentioned,"LazyCat, powerkatz, OfﬁceCommu.dll, PowershellAgent, Mimikatz.",Government and defense agencies
2019-02-27,A Peek into BRONZE UNION's Toolbox,,https://github.com/CyberMonitor/APT_CyberCriminal_Campagin_Collections/raw/master/2019/2019.02.27.BRONZE_UNION_Toolbox/A%20Peek%20into%20BRONZE%20UNION%E2%80%99s%20Toolbox.pdf,BRONZE UNION,Not mentioned,Not mentioned,Malicious Documents (Word document downloader),"ZxShell, Gh0st RAT, HTran, SysUpdate, HyperBro",Not mentioned
2019-03-06,taidoor_analysis_jp,,https://github.com/CyberMonitor/APT_CyberCriminal_Campagin_Collections/raw/master/2019/2019.03.06_Taidoor_Analysis/taidoor_analysis_jp.pdf,Not mentioned,Japan,Not mentioned,"SpearPhishing, Malicious Documents","Taidoor, PoshC2, SERKDES",Corporations and Businesses
2019-03-07,security-report-2019,,https://github.com/CyberMonitor/APT_CyberCriminal_Campagin_Collections/raw/master/Report/2019.02.Targeted_Attacks/security-report-2019.pdf,Advanced Persistent Threats (APTs),Not mentioned.,TRUE,"SpearPhishing, Malicious Documents, Exploit Vulnerability.",Not mentioned,"Critical infrastructure, Cloud/IoT services, Corporations and Businesses, Government and defense agencies, Financial institutions."
2019-03-12,Operation_Comando,,https://github.com/CyberMonitor/APT_CyberCriminal_Campagin_Collections/raw/master/2019/2019.03.12.Operation_Comando/Operation_Comando.pdf,Not mentioned.,Brazil,Not mentioned,"SpearPhishing, Malicious Documents","AsyncRAT, NanoCoreRAT, RemcosRAT, Lime-RAT, MSHTA, PowerShell, Revenge Remote Access Trojan (RAT), VB.NET",Corporations and Businesses
2019-03-13,Operation_Sheep,,https://github.com/CyberMonitor/APT_CyberCriminal_Campagin_Collections/raw/master/2019/2019.03.13.Operation_Sheep/Operation_Sheep.pdf,Not mentioned,China,FALSE,Website Equipping,SWAnalytics (Pilfer-Analytics SDK),Individuals
2019-03-22,LUCKY ELEPHANT Campaign Masquerading,,https://github.com/CyberMonitor/APT_CyberCriminal_Campagin_Collections/raw/master/2019/2019.03.22.LUCKY_ELEPHANT/LUCKY%20ELEPHANT%20Campaign%20Masquerading.pdf,DoNot Team,"Pakistan, Bangladesh, Sri Lanka, Maldives, Myanmar, Nepal.",Not mentioned,"Phishing, Social Engineering",Not mentioned,"Government and defense agencies, Corporations and Businesses, Non-Governmental Organizations (NGOs) and Nonprofits."
2019-03-28,Threat Actor Group using UAC Bypass Module to run BAT File,,https://github.com/CyberMonitor/APT_CyberCriminal_Campagin_Collections/raw/master/2019/2019.03.28.UAC_Bypass_BAT_APT/Threat%20Actor%20Group%20using%20UAC%20Bypass%20Module%20to%20run%20BAT%20File.pdf,Not mentioned,"South Korea, the US, and East Asia",Not mentioned,"SpearPhishing, Malicious Documents","BABYFACE, SYSCON, UAC Bypass Module",Not mentioned
2019-04-02,OceanLotus-Steganography-Malware-Analysis-White-Paper,,https://github.com/CyberMonitor/APT_CyberCriminal_Campagin_Collections/raw/master/2019/2019.04.02.OceanLotus_Steganography/OceanLotus-Steganography-Malware-Analysis-White-Paper.pdf,OceanLotus,Not mentioned,Not mentioned,Not mentioned,"Veil “shellcode_inject” payload, OceanLotus, Remy backdoor, Denes backdoor, DNSProvider, HTTPProv.",Not mentioned
2019-04-10,Gaza Cybergang Group1 operation SneakyPastes,,https://github.com/CyberMonitor/APT_CyberCriminal_Campagin_Collections/raw/master/2019/2019.04.10.Operation_SneakyPastes/Gaza%20Cybergang%20Group1%20operation%20SneakyPastes.pdf,Gaza Cybergang Group1,"Palestinian Territories, Jordan, Israel, Lebanon, Saudi Arabia, Syria, Egypt, UAE, Senegal, France, Germany, Iran, Malaysia, Belgium, Bosnia and Herzegovina, Libya, Morocco, Spain, Sri Lanka, Tunisia, Afghanistan, Armenia, Azerbaijan, Cyprus, India, Indonesia, Iraq, Ireland, Italy, Kuwait, Oman, Poland, Romania, Russia, Serbia, Slovenia, Sudan, UK, USA.",Not mentioned.,SpearPhishing,"PowerShell, VBS, JS, dotnet, Winrar, Razy, NeD worm, Wonder Botnet.","Government and defense agencies, Financial institutions, Healthcare, Education and research institutions, Media and entertainment companies, Individuals."
2019-04-10,ASEC_REPORT_vol.94_ENG,,https://github.com/CyberMonitor/APT_CyberCriminal_Campagin_Collections/raw/master/Report/AhnLab/ASEC_REPORT_vol.94_ENG.pdf,Not mentioned,South Korea and worldwide.,FALSE,"Malicious Documents, Social Engineering","XMRig, srv64, tpagentservice.dll, spoolsv64.exe, MsraReportDataCache32.tlb, TrustedHostServices.exe, sample.exe, svchost.exe, CoinMiner, Mimikatz, iiiiiiii.exe, Gh0st RAT.",Corporations and Businesses
2019-04-19,Funky malware format found in Ocean Lotus sample,,https://github.com/CyberMonitor/APT_CyberCriminal_Campagin_Collections/raw/master/2019/2019.04.19.Funky_malware_format/Funky%20malware%20format%20found%20in%20Ocean%20Lotus%20sample.pdf,"Ocean Lotus, also known as APT 32.",Vietnamese activists,Not mentioned,SpearPhishing,"BLOB, CAB, sporder.vbs, wscript.exe",Individuals
2019-05-07,Buckeye_ Espionage Outfit Used Equation Group Tools Prior to Shadow Brokers Leak,,https://github.com/CyberMonitor/APT_CyberCriminal_Campagin_Collections/raw/master/2019/2019.05.07.Buckeye/Buckeye_%20Espionage%20Outfit%20Used%20Equation%20Group%20Tools%20Prior%20to%20Shadow%20Brokers%20Leak.pdf,Buckeye,"Hong Kong, Luxembourg, Philippines, Vietnam, U.S., Belgium, Sweden, Italy, UK",TRUE,Exploit Vulnerability,"Backdoor.Pirpi, Filensfer, Bemstour Exploit Tool, DoublePulsar, Trojan.Bemstour, EternalRomance, EternalSynergy, HTran, command line utility to list user accounts on remote machine, command line SMB client.",Not mentioned
2019-05-08,FIN7.5_ the infamous cybercrime rig 'FIN7' continues its activities,,https://github.com/CyberMonitor/APT_CyberCriminal_Campagin_Collections/raw/master/2019/2019.05.08.Fin7.5/FIN7.5_%20the%20infamous%20cybercrime%20rig%20%E2%80%9CFIN7%E2%80%9D%20continues%20its%20activities.pdf,FIN7,Not mentioned,FALSE,"SpearPhishing, Social Engineering, Malicious Documents, Exploit Vulnerability.","GRIFFON, CobaltStrike, Powershell Empire, ThreadKit, MS Office exploits.",Corporations and Businesses
2019-05-09,Iranian-Nation-State-APT-Leak-Analysis-and-Overview,,https://github.com/CyberMonitor/APT_CyberCriminal_Campagin_Collections/raw/master/2019/2019.05.09.Iranian_APT_Leak/Iranian-Nation-State-APT-Leak-Analysis-and-Overview.pdf,OilRig,"Sri Lanka, India, UAE, Dubai, Thailand, Philippines, Syria, Azerbaijan, Afghanistan, Pakistan, Hong Kong, Oman, Israel, Turkey, Iraq, Qatar, Lebanon, Malaysia, Indonesia, Kyrgyzstan, Kuwait, Bahrain, Egypt, Morocco, Ethiopia, Kenia, South Africa, Mauritius, Fiji, New Zealand, Australia, Colombia.",Not mentioned,"*   **Phishing**: Attack on Thai Airways, Phishing attacks on numerous firms.
*   **SpearPhishing**: Communication directly with people related to the Foreign Ministry.
*   **Exploit Vulnerability**: Locating vulnerable websites hosted on the governmental network (Azerbaijani Department of Health).",Not mentioned,"Government and defense agencies, Corporations and Businesses."
2019-05-11,Chineses Actor APT target Ministry of Justice Vietnamese,,https://github.com/CyberMonitor/APT_CyberCriminal_Campagin_Collections/raw/master/2019/2019.05.11.Chinese_APT_Vietnamese/Chineses%20Actor%20APT%20target%20Ministry%20of%20Justice%20Vietnamese.pdf,Chineses Actor APT,Vietnam,FALSE,"SpearPhishing, Malicious Documents, Exploit Vulnerability.",Gh0st RAT,Government and defense agencies
2019-05-13,"ScarCruft continues to evolve, introduces Bluetooth harvester _ Securelist",,https://github.com/CyberMonitor/APT_CyberCriminal_Campagin_Collections/raw/master/2019/2019.05.13.ScarCruft_Bluetooth/ScarCruft%20continues%20to%20evolve%2C%20introduces%20Bluetooth%20harvester%20_%20Securelist.pdf,ScarCruft,"Vietnam, Russia, Hong Kong, North Korea",TRUE,"SpearPhishing, Watering Hole, Exploit Vulnerability","Bluetooth harvester, ROKRAT, UACME","Financial institutions, Corporations and Businesses, Government and defense agencies."
2019-05-15,Winnti_ More than just Windows and Gates,,https://github.com/CyberMonitor/APT_CyberCriminal_Campagin_Collections/raw/master/2019/2019.05.15.Winnti_More/Winnti_%20More%20than%20just%20Windows%20and%20Gates.pdf,Project Sauron,Germany and Vietnam.,Not mentioned,Not mentioned,"Winnti, libxselinux, libxselinux.so, Nmap.","Healthcare, Media and entertainment companies"
2019-05-22,A journey to Zebrocy land,,https://github.com/CyberMonitor/APT_CyberCriminal_Campagin_Collections/raw/master/2019/2019.05.22.Zebrocy_Land/A%20journey%20to%20Zebrocy%20land.pdf,Sednit group,Middle East and Central Asia,FALSE,"SpearPhishing, Social Engineering, Exploit Vulnerability","Zebrocy Delphi backdoor, Win32/TrojanDownloader.Sednit.CMT, Win32/HackTool.PSWDump.D, Win32/PSW.Agent.OGE.",Not mentioned
2019-05-29,TA505 is Expanding its Operations,,https://github.com/CyberMonitor/APT_CyberCriminal_Campagin_Collections/raw/master/2019/2019.05.29.TA505/TA505%20is%20Expanding%20its%20Operations.pdf,TA505,"Italy, US",Not mentioned,"SpearPhishing, Malicious Documents","RMS (Remote Manipulator System), MPress PE compressor utility, Stealthy Email Stealer, malicious macro.","Financial institutions, Corporations and Businesses"
2019-06-03,Zebrocy Multilanguage Malware Salad,,https://github.com/CyberMonitor/APT_CyberCriminal_Campagin_Collections/raw/master/2019/2019.06.03.Zebrocy/Zebrocy%20Multilanguage%20Malware%20Salad.pdf,Zebrocy,"Kazakhstan, Tajikistan, Turkmenistan, Germany, Kyrgyzstan, United Kingdom, Myanmar, Syrian Arab Republic, Ukraine, Afghanistan, Tanzania, Iran.",FALSE,SpearPhishing,"Zebrocy, AutoIT, Delphi, C#, PowerShell, Go, Python, Nim.",Government and defense agencies
2019-06-04,An APT Blueprint Gaining New Visibility into Financial Threats,,https://www.bitdefender.com/files/News/CaseStudies/study/262/Bitdefender-WhitePaper-An-APT-Blueprint-Gaining-New-Visibility-into-Financial-Threats-interactive.pdf,Carbanak,"Russia, the United Kingdom, the Netherlands, Spain, Romania, Belarus, Poland, Estonia, Bulgaria, Georgia, Moldova, Kyrgyzstan, Armenia, Taiwan, Malaysia, Eastern Europe, USA, and Europe.",Not mentioned,"SpearPhishing, Malicious Documents, Exploit Vulnerability","`powershell.exe`, `mstsc.exe`, `psexec.exe`, `psexesvc.exe`, `smrs.exe`, `java.exe`, `rad353F7.tmp`, `jusched.exe`, `nusb1mon.exe`, `netscan.exe`, DLL dropper, JavaScript backdoor.",Financial institutions
2019-06-10,wp_new_muddywater_findings_uncovered,,https://github.com/CyberMonitor/APT_CyberCriminal_Campagin_Collections/raw/master/2019/2019.06.10.MuddyWater_Resurfaces/wp_new_muddywater_findings_uncovered.pdf,MuddyWater,"Middle Eastern countries, Asian countries, Europe, United States, Turkey, Pakistan, Afghanistan.",Not mentioned,"SpearPhishing, Malicious Documents, Exploit Vulnerability","POWERSTATS v3, Microsoft Script Encoder, Powershell.exe, CrackMapExec, ChromeCookiesView, chrome-passwords, EmpireProject, FruityC2, Koadic, LaZagne, Meterpreter, Mimikatz, MZCookiesView, PowerSploit, Shootback, Smbmap, SHARPSTATS, DELPHSTATS.","Government and defense agencies, Financial institutions, Education and research institutions, Corporations and Businesses."
