Date,Filename,Title,Download Url,Threat Actor,Victim Country,Zero-Day,Attack Vector,Malware,Target Sector
2020-11-30,Threat actor leverages coin miner techniques to stay under the radar - here's how to spot them - Microsoft Security,,https://github.com/CyberMonitor/APT_CyberCriminal_Campagin_Collections/raw/master/2020/2020.11.30.BISMUTH_CoinMiner/Threat%20actor%20leverages%20coin%20miner%20techniques%20to%20stay%20under%20the%20radar%20%E2%80%93%20here%E2%80%99s%20how%20to%20spot%20them%20-%20Microsoft%20Security.pdf,BISMUTH,France and Vietnam,Not mentioned,"SpearPhishing, Malicious Documents","Coin miner, DebugView, Mimikatz, Empire, KerrDown, MsMpEng.exe, MpSvc.dll, wwlib.dll, mpr.dll.","Government and defense agencies, Corporations and Businesses, Financial institutions, Education and research institutions, Non-Governmental Organizations (NGOs) and Nonprofits."
2020-12-02,Turla Crutch_ Keeping the 'back door' open _ WeLiveSecurity,,https://github.com/CyberMonitor/APT_CyberCriminal_Campagin_Collections/raw/master/2020/2020.12.02.Turla_Crutch/Turla%20Crutch_%20Keeping%20the%20%E2%80%9Cback%20door%E2%80%9D%20open%20_%20WeLiveSecurity.pdf,Turla APT group,A country of the European Union.,Not mentioned,Credential Reuse.,"Crutch, Gazer, WhiteBear, FatDuke, Dropbox, Visual Studio 2012, RC4.",Government and defense agencies
2020-12-09,Russian APT Uses COVID-19 Lures to Deliver Zebrocy - Intezer,,https://github.com/CyberMonitor/APT_CyberCriminal_Campagin_Collections/raw/master/2020/2020.12.09.Sofacy_APT/Russian%20APT%20Uses%20COVID-19%20Lures%20to%20Deliver%20Zebrocy%20-%20Intezer.pdf,Sandworm,"Afghanistan, Azerbaijan, Bosnia and Herzegovina, China, Egypt, Georgia, Iran, Japan, Kazakhstan, Korea, Kyrgyzstan, Mongolia, Russia, Saudi Arabia, Serbia, Switzerland, Tajikistan, Turkey, Turkmenistan, Ukraine, Uruguay, and Zimbabwe.",Not mentioned,"SpearPhishing, Phishing, Malicious Documents","Zebrocy, gobfuscator","Government and defense agencies, Corporations and Businesses"
2020-12-09,"SideWinder Uses South Asian Issues for Spear Phishing, Mobile Attacks",,https://github.com/CyberMonitor/APT_CyberCriminal_Campagin_Collections/raw/master/2020/2020.12.09.SideWinder/SideWinder%20Uses%20South%20Asian%20Issues%20for%20Spear%20Phishing%2C%20Mobile%20Attacks.pdf,SideWinder,Nepal and Afghanistan.,Not mentioned.,"SpearPhishing, Phishing, Malicious Documents, Exploit Vulnerability.","Metasploit, Trojan.MSIL.SIDEWINDER.A",Government and defense agencies
2020-12-15,Finding APTX Attacks via MITRE TTPs,,https://documents.trendmicro.com/assets/white_papers/wp-finding-APTX-attributing-attacks-via-MITRE-TTPs.pdf,APT32,Not mentioned,Not mentioned,Not mentioned,"TROJ_SHELLLOAD, HKTL_FTPEXFIL, TSPY_KARYAL, TSPY_PILFERDOC, BKDR_XRAT.ZCHB, BKDR_NULTUS.ZCGK, BKDR64_HANNOTOG.ZAGK, BKDR_HANNOTOG.ZBGK, BKDR_HANNOTOG.ZCGK, TROJ64_SAGRUNEX.SMZTGD-A, BKDR64_METREVHTTPS.ZCGK, HKTL_FILEDOWNLD, Hacktool.Win32.NBTScan.A, BKDR64_WYZINA.ZBGK, TROJ_CMDINJECT, TROJ64_CMDINJECT, HackTool.Win64.MIIKATZ.AO, HKTL_MIMICLI, NBTScanner, wmic, cmd.exe.","Corporations and Businesses, Government and defense agencies"
2020-12-15,Finding APTX Attacks via MITRE TTPs,,https://documents.trendmicro.com/assets/white_papers/wp-finding-APTX-attributing-attacks-via-MITRE-TTPs.pdf,APT32,Not mentioned,Not mentioned,Not mentioned.,"TROJ_SHELLLOAD, HKTL_FTPEXFIL, TSPY_KARYAL, TSPY_PILFERDOC, BKDR_XRAT.ZCHB, BKDR_NULTUS.ZCGK, MITRE ATT&CK, BKDR64_HANNOTOG.ZAGK, BKDR_HANNOTOG.ZBGK, BKDR_HANNOTOG.ZCGK, TROJ64_SAGRUNEX.SMZTGD-A, BKDR64_METREVHTTPS.ZCGK, HKTL_FILEDOWNLD, Hacktool.Win32.NBTScan.A, BKDR64_WYZINA.ZBGK, TROJ_CMDINJECT, TROJ64_CMDINJECT, HackTool.Win64.MIIKATZ.AO, HKTL_MIMICLI, NBTScanner.","Corporations and Businesses, Government and defense agencies."
2021-01-04,APT27+turns+to+ransomware,,https://github.com/CyberMonitor/APT_CyberCriminal_Campagin_Collections/raw/master/2021/2021.01.04.APT27_Ransomware/APT27%2Bturns%2Bto%2Bransomware.pdf,APT27,Not mentioned,Not mentioned,Not mentioned,"ASPXSpy, PlugX, Clambling, Google Updater, Mimikatz, CVE-2017-0213, BitLocker.",Not mentioned
2021-01-04,nao-sec.org-Royal Road ReDive,,https://github.com/CyberMonitor/APT_CyberCriminal_Campagin_Collections/raw/master/2021/2021.01.04.Royal_Road_ReDive/nao-sec.org-Royal%20Road%20ReDive.pdf,FunnyDream,"Southeast Asia (Vietnam, Malaysia), United States, Japan",Not mentioned,"Malicious Documents, Exploit Vulnerability","XLBug RAT, AttackBot, Enfal, BYEBY","Government and defense agencies, Energy and utilities."
2021-01-06,blog.malwarebytes.com-Retrohunting APT37 North Korean APT used VBA self decode technique to inject RokRat,,https://github.com/CyberMonitor/APT_CyberCriminal_Campagin_Collections/raw/master/2021/2021.01.06.APT37_North_Korean_APT_RokRat/blog.malwarebytes.com-Retrohunting%20APT37%20North%20Korean%20APT%20used%20VBA%20self%20decode%20technique%20to%20inject%20RokRat.pdf,"APT37, ScarCruft, Reaper, Group123",South Korea,Not mentioned,"SpearPhishing, Malicious Documents",RokRat,Not mentioned
2021-01-08,Charming Kitten's Christmas Gift - Certfa Lab,,https://github.com/CyberMonitor/APT_CyberCriminal_Campagin_Collections/raw/master/2021/2021.01.08.Charming_Kitten_Christmas_Gift/Charming%20Kitten%E2%80%99s%20Christmas%20Gift%20-%20Certfa%20Lab.pdf,Charming Kitten,"Countries around the Persian Gulf, Europe, and the US.",Not mentioned,"SpearPhishing, Phishing",Not mentioned,"Individuals, Education and research institutions, Media and entertainment companies, Non-Governmental Organizations (NGOs) and Nonprofits, Corporations and Businesses, Government and defense agencies, Cloud/IoT services."
2021-01-12,yoroi.company-Opening STEELCORGI A Sophisticated APT Swiss Army Knife,,https://github.com/CyberMonitor/APT_CyberCriminal_Campagin_Collections/raw/master/2021/2021.01.12.STEELCORGI/yoroi.company-Opening%20STEELCORGI%20A%20Sophisticated%20APT%20Swiss%20Army%20Knife.pdf,"TH-239, also mentioned as UNC1945.",Europe and Italy,Not mentioned,Not mentioned,"Backfire, Ricochet, STEELCORGI",Corporations and Businesses
2021-01-20,A Deep Dive Into Patchwork APT Group _ Cyble,,https://github.com/CyberMonitor/APT_CyberCriminal_Campagin_Collections/raw/master/2021/2021.01.20.Deep_Dive_Patchwork/A%20Deep%20Dive%20Into%20Patchwork%20APT%20Group%20_%20Cyble.pdf,Patchwork APT Group,"Pakistan, Sri-Lanka, Uruguay, Bangladesh, Taiwan, Australia, USA, China.",FALSE,"SpearPhishing, Malicious Documents, Exploit Vulnerability",MSBuild.exe (keylogger payload),Not mentioned
2021-01-31,JSAC2021_202_niwa-yanagishita_en,,https://github.com/CyberMonitor/APT_CyberCriminal_Campagin_Collections/raw/master/2021/2021.01.31.A41APT/JSAC2021_202_niwa-yanagishita_en.pdf,A41APT,Japan,Not mentioned,"Exploit Vulnerability, Credential Reuse","SodaMaster, P8RAT, DESLoader, FYAntiLoader, xRAT, Stager Shellcode.",Not mentioned
2021-02-01,operation-nightscout-supply-chain-attack-online-gaming-asia,,https://github.com/CyberMonitor/APT_CyberCriminal_Campagin_Collections/raw/master/2021/2021.02.01.Operation_NightScout/operation-nightscout-supply-chain-attack-online-gaming-asia.pdf,Not mentioned,"Taiwan, Hong Kong, and Sri Lanka.",Not mentioned,Drive-by Download,"Gh0st RAT, PoisonIvy RAT","Government and defense agencies, Education and research institutions, Media and entertainment companies"
2021-02-17,cybleinc.com-Confucius APT Android Spyware Targets Pakistani and Other South Asian Regions,,https://github.com/CyberMonitor/APT_CyberCriminal_Campagin_Collections/raw/master/2020/2021.02.17.Confucius_Pakistani_South_Asian/cybleinc.com-Confucius%20APT%20Android%20Spyware%20Targets%20Pakistani%20and%20Other%20South%20Asian%20Regions.pdf,Confucius,Pakistani and other South Asian regions.,Not mentioned,"Phishing, Malicious Documents, Social Engineering","Confucius malware, bing.dll, linknew.dll, update.exe","Government and defense agencies, Individuals."
2021-02-17,Confucius APT Android Spyware Targets Pakistani and Other South Asian Regions - Cyble,,https://github.com/CyberMonitor/APT_CyberCriminal_Campagin_Collections/raw/master/2021/2021.02.17.Confucius_Pakistani_South_Asian/Confucius%20APT%20Android%20Spyware%20Targets%20Pakistani%20and%20Other%20South%20Asian%20Regions%20%E2%80%94%20Cyble.pdf,Confucius APT,Pakistani and Other South Asian Regions,Not mentioned,Not mentioned,Not mentioned,Not mentioned
2021-02-22,research.checkpoint.com-The Story of Jian  How APT31 Stole and Used an Unknown Equation Group 0-Day,,https://github.com/CyberMonitor/APT_CyberCriminal_Campagin_Collections/raw/master/2021/2021.02.22.APT31_Equation_Group/research.checkpoint.com-The%20Story%20of%20Jian%20%20How%20APT31%20Stole%20and%20Used%20an%20Unknown%20Equation%20Group%200-Day.pdf,Equation Group,US,TRUE,Exploit Vulnerability,"Mcl_NtElevation_EpMe_GrSa.dll, Mcl_NtElevation_EpMo_GrSa.dll, Lost in Translation, DanderSpritz, Eternal Blue, Jian, tools.dll, 2008.dll, Houston Disk, DanderSpritz – ElEi, DanderSpritz – ErNi, DanderSpritz – EpMo, DanderSpritz – EpMe, Add.dll.",Corporations and Businesses
2021-02-24,amnesty.org-Click and Bait Vietnamese Human Rights Defenders Targeted with Spyware Attacks,,https://github.com/CyberMonitor/APT_CyberCriminal_Campagin_Collections/raw/master/2021/2021.02.24.Click_and_Bait/amnesty.org-Click%20and%20Bait%20Vietnamese%20Human%20Rights%20Defenders%20Targeted%20with%20Spyware%20Attacks.pdf,Ocean Lotus,"Viet Nam, and countries where Vietnamese activists reside.",Not mentioned,"SpearPhishing, Malicious Documents, Phishing, Exploit Vulnerability","Cobalt Strike, Kerrdown","Individuals, Non-Governmental Organizations (NGOs) and Nonprofits"
2021-02-25,kaspersky-ics-cert-lazarus-targets-defense-industry-with-threatneedle-en-20210225,,https://github.com/CyberMonitor/APT_CyberCriminal_Campagin_Collections/raw/master/2021/2021.02.25.Lazarus_ThreatNeedle/kaspersky-ics-cert-lazarus-targets-defense-industry-with-threatneedle-en-20210225.pdf,Lazarus,More than a dozen countries.,FALSE,"SpearPhishing, Malicious Documents","ThreatNeedle, Manuscrypt, NukeSped, Responder, WMIC, PuTTy PSCP.","Government and defense agencies, Financial institutions, Healthcare"
2021-03-02,Operation Exchange Marauder_ Active Exploitation of Multiple Zero-Day Microsoft Exchange Vulnerabilities _ Volexity,,https://github.com/CyberMonitor/APT_CyberCriminal_Campagin_Collections/raw/master/2021/2021.03.02.Operation_Exchange_Marauder/Operation%20Exchange%20Marauder_%20Active%20Exploitation%20of%20Multiple%20Zero-Day%20Microsoft%20Exchange%20Vulnerabilities%20_%20Volexity.pdf,Not mentioned,Not mentioned,TRUE,Exploit Vulnerability (authentication bypass and RCE),"SIMPLESEESHARP, SPORTSBALL, China Chopper variants, ASPXSPY, rundll32, MiniDump, PsExec, ProcDump, WinRar Command Line Utility, ASPX webshells, PHP webshells, antSword/v2.1, reGeorgTunnel.",Not mentioned
2021-03-18,SilverFish_TLPWHITE,,https://github.com/CyberMonitor/APT_CyberCriminal_Campagin_Collections/raw/master/2021/2021.03.18.SilverFish_Group/SilverFish_TLPWHITE.pdf,SilverFishAPTGroup,"US, Italy, the Netherlands, Denmark, Austria, France, Great Britain, Canada, and Mexico.",Not mentioned,Not mentioned,"Dridex, WastedLocker, TrickBot (infrastructure/codebase), CobaltStrike, and Koadic.","**Government and defense agencies:** Government entities, Defense & Aviation, US military contractors, Police Networks, US public institutions, a global organization comprised of 193 countries.
**Corporations and Businesses:** Services & Hospitality, Information Technology, Fortune 500 enterprise companies, IT manufacturers and solution providers, Auditing/consulting groups, IT security vendors, Construction.
**Financial institutions:** Banking institutions.
**Healthcare:** Public Health Departments, Pharmaceutical companies, COVID-19 testing kit manufacturers.
**Energy and utilities:** Energy.
**Manufacturing:** Automotive manufacturing groups, Aviation and aerospace manufacturing/R&D companies.
**Education and research institutions:** Education.
**Critical infrastructure:** Airport Systems."
2021-03-23,"Websites Hosting Cracks Spread Malware, Adware",,https://github.com/CyberMonitor/APT_CyberCriminal_Campagin_Collections/raw/master/2021/2021.03.23.CopperStealer/Websites%20Hosting%20Cracks%20Spread%20Malware%2C%20Adware.pdf,Not mentioned,Not mentioned,Not mentioned,Social Engineering,"CopperStealer, DanaBot (TROJ_BANLOAD.THFOAAH), Glupteba (Trojan.Win32.GLUPTEBA.WLDR), MiniThunderPlatform, xldl.dll, Smokeloader/Dofoil, FsFilter32/FsFilter64 rootkit, EdgeCookiesView.",Individuals.
2021-03-30,BadBlood_ TA453 Targets US and Israeli Medical Research Personnel in Credential Phishing Campaigns _ Proofpoint US,,https://github.com/CyberMonitor/APT_CyberCriminal_Campagin_Collections/raw/master/2021/2021.03.30.BadBlood_TA453/BadBlood_%20TA453%20Targets%20US%20and%20Israeli%20Medical%20Research%20Personnel%20in%20Credential%20Phishing%20Campaigns%20_%20Proofpoint%20US.pdf,TA453,US and Israel,Not mentioned,SpearPhishing,Not mentioned,"Healthcare, Education and research institutions"
2021-04-02,Joint CSA AA21-092A APT Actors Exploit Vulnerabilitiesto Gain Initial Access for Future Attacks,,https://www.ic3.gov/Media/News/2021/210402.pdf,Not mentioned,Not mentioned,FALSE,"Exploit Vulnerability, SpearPhishing",Not mentioned,"Government and defense agencies, Corporations and Businesses, Critical infrastructure."
2021-04-06,Threat Group Uses Voice Changing Software in Espionage Attempt - Cado Security _ Cloud Native Digital Forensics,,https://github.com/CyberMonitor/APT_CyberCriminal_Campagin_Collections/raw/master/2021/2021.04.06.APT-C-23_Voice_Changing/Threat%20Group%20Uses%20Voice%20Changing%20Software%20in%20Espionage%20Attempt%20-%20Cado%20Security%20_%20Cloud%20Native%20Digital%20Forensics.pdf,APT-C-23 or Molerats,"Palestine, Israeli government, and Western Governments.",Not mentioned,"SpearPhishing, Watering Hole, Social Engineering","recon.exe, MorphVox","Government and defense agencies, Individuals, Financial institutions, Non-Governmental Organizations (NGOs) and Nonprofits."
2021-04-07,Cisco Talos Intelligence Group - Comprehensive Threat Intelligence_ Sowing Discord_ Reaping the benefits of collaboration app abuse,,https://github.com/CyberMonitor/APT_CyberCriminal_Campagin_Collections/raw/master/2021/2021.04.07.Sowing_Discord/Cisco%20Talos%20Intelligence%20Group%20-%20Comprehensive%20Threat%20Intelligence_%20Sowing%20Discord_%20Reaping%20the%20benefits%20of%20collaboration%20app%20abuse.pdf,Not mentioned,Not mentioned,Not mentioned.,"Phishing, Social Engineering","Remcos, AsyncRAT, PowerShell, Microsoft Word","Financial institutions, Non-Governmental Organizations (NGOs) and Nonprofits, Corporations and Businesses, Individuals."
2021-04-08,"(Are you) afreight of the dark_ Watch out for Vyveva, new Lazarus backdoor _ WeLiveSecurity",,https://github.com/CyberMonitor/APT_CyberCriminal_Campagin_Collections/raw/master/2021/2021.04.08.Vyveva_Lazarus/%28Are%20you%29%20afreight%20of%20the%20dark_%20Watch%20out%20for%20Vyveva%2C%20new%20Lazarus%20backdoor%20_%20WeLiveSecurity.pdf,Lazarus,South Africa,Not mentioned,Not mentioned,"Vyveva, NukeSped, Tor network (Tor services, TorSocket.dll).",Corporations and Businesses
2021-04-09,Iron Tiger APT Updates Toolkit With Evolved SysUpdate Malware,,https://github.com/CyberMonitor/APT_CyberCriminal_Campagin_Collections/raw/master/2021/2021.04.09.Iron_Tiger_SysUpdate/Iron%20Tiger%20APT%20Updates%20Toolkit%20With%20Evolved%20SysUpdate%20Malware.pdf,Iron Tiger,"Philippines, Middle East, and Southeast Asia.",Not mentioned,"Watering Hole: Watering holes; Malicious Documents: Weaponized documents exploiting Dynamic Data Exchange (DDE) and CVE-2018-0798; Exploit Vulnerability: Exploitation of CVE-2019-0604, CVE-2021-26855, CVE-2021-26857, CVE-2021-26858, CVE-2021-27065, and CVE-2020-0688; Website Equipping: Supply chain attack compromising a chat software installer.","SysUpdate Malware, FRP Tool, Type 1 Malware Family, HyperBro, Pandora, Able Desktop","Government and defense agencies, Corporations and Businesses, Financial institutions, Energy and utilities."
2021-04-13,"eSentire _ Hackers Flood the Web with 100,000 Malicious Pages",,https://github.com/CyberMonitor/APT_CyberCriminal_Campagin_Collections/raw/master/2021/2021.04.13.Hackers_Flood/eSentire%20_%20Hackers%20Flood%20the%20Web%20with%20100%2C000%20Malicious%20Pages%2C%E2%80%A6.pdf,SolarMarker group,Not mentioned,FALSE,"Website Equipping, Social Engineering","SolarMarker, Jupyter, Yellow Cockatoo, Polazert, .NET software framework, Slim PDF reader, PowerShell.","Corporations and Businesses, Financial institutions"
2021-04-13,Zero-day vulnerability in Desktop Window Manager (CVE-2021-28310) used in the wild _ Securelist,,https://github.com/CyberMonitor/APT_CyberCriminal_Campagin_Collections/raw/master/2021/2021.04.13.CVE-2021-28310_APT/Zero-day%20vulnerability%20in%20Desktop%20Window%20Manager%20%28CVE-2021-28310%29%20used%20in%20the%20wild%20_%20Securelist.pdf,BITTER APT group,Not mentioned,TRUE,Exploit Vulnerability,Not mentioned,Not mentioned
2021-04-28,Water Pamola Attacked Online Shops Via Malicious Orders,,https://github.com/CyberMonitor/APT_CyberCriminal_Campagin_Collections/raw/master/2021/2021.04.28.Water_Pamola/Water%20Pamola%20Attacked%20Online%20Shops%20Via%20Malicious%20Orders.pdf,Water Pamola,"Japan, Australia, and European countries.",Not mentioned,"Exploit Vulnerability, Social Engineering, Phishing","XSS.ME, Gh0st RAT (Gh0stCringe/CineregRAT), Stud_PE, Fiddler, EC-CUBE framework.",Corporations and Businesses.
2021-05-01,MuddyWater Binder Project Part 1,,https://github.com/CyberMonitor/APT_CyberCriminal_Campagin_Collections/raw/master/2021/2021.05.01.MuddyWater_Binder_1/MuddyWater%20Binder%20Project%20Part%201.pdf,MuddyWater,Not mentioned,Not mentioned,Not mentioned,"Binder, Microsoft Visual Studio, RestClient, RestRequest.",Individuals
2021-05-01,CryptoCore-Lazarus-Clearsky,,https://github.com/CyberMonitor/APT_CyberCriminal_Campagin_Collections/raw/master/2021/2021.05.01.CryptoCore-Lazarus/CryptoCore-Lazarus-Clearsky.pdf,LAZARUS,"Companies and organizations around the world, specifically in Israel and Japan.",Not mentioned,SpearPhishing,"RAT, STEALER, ntuser.cat, Themida, VMProtect, VBS script, msoRAT, CryptoCore.","Financial institutions, Corporations and Businesses"
2021-05-06,Operation TunnelSnake _ Securelist,,https://github.com/CyberMonitor/APT_CyberCriminal_Campagin_Collections/raw/master/2021/2021.05.06.Operation_TunnelSnake/Operation%20TunnelSnake%20_%20Securelist.pdf,Not mentioned,"South-East Asia, Africa, and South Asia.",Not mentioned,Not mentioned,"MoriyaServiceX64.dll, ProcessKillerX64.dll, DSEFix, China Chopper, BOUNCER, Termite, Earthworm, commodity webshell, open-source legacy code for loading unsigned drivers.",Government and defense agencies
2021-05-07,Advisory Further TTPs associated with SVR cyber actors,,https://github.com/CyberMonitor/APT_CyberCriminal_Campagin_Collections/raw/master/2021/2021.05.07.SVR_TTPs/Advisory%20Further%20TTPs%20associated%20with%20SVR%20cyber%20actors.pdf,SVR cyber actors,Not mentioned,FALSE,Exploit Vulnerability,"Sliver, WellMess, WellMail, Cobalt Strike, GoldFinder, GoldMax, Sibot.","Government and defense agencies, Energy and utilities, Healthcare, Education and research institutions, Non-Governmental Organizations (NGOs) and Nonprofits"
2021-05-13,blog.talosintelligence.com-Transparent Tribe APT expands its Windows malware arsenal,,https://github.com/CyberMonitor/APT_CyberCriminal_Campagin_Collections/raw/master/2021/2021.05.13.Transparent_Tribe_APT/blog.talosintelligence.com-Transparent%20Tribe%20APT%20expands%20its%20Windows%20malware%20arsenal.pdf,"Transparent Tribe, APT36, Mythic Leopard","India, Iran, Pakistan, Afghanistan.",Not mentioned,"SpearPhishing, Social Engineering, Website Equipping, Malicious Documents.","CrimsonRAT, ObliqueRAT",Government and defense agencies
2021-05-25,evol-agrius,,https://github.com/CyberMonitor/APT_CyberCriminal_Campagin_Collections/raw/master/2021/2021.05.25.AGRIUSAuthor/evol-agrius.pdf,Agrius,"Israel, United Arab Emirates",FALSE,Exploit Vulnerability,"ASPXSpy, webshells, IPsec Helper, PRIVATECODE.",Critical infrastructure
2021-05-27,New sophisticated email-based attack from NOBELIUM - Microsoft Security,,https://github.com/CyberMonitor/APT_CyberCriminal_Campagin_Collections/raw/master/2021/2021.05.27.NOBELIUM_New/New%20sophisticated%20email-based%20attack%20from%20NOBELIUM%20-%20Microsoft%20Security.pdf,NOBELIUM,Not mentioned,TRUE,"SpearPhishing (emails with tracking URLs, attached HTML files, or URLs redirecting to attacker infrastructure/spoofed websites); Malicious Documents (attached HTML files, HTML encoding/redirecting to ISO/RTF); Drive-by Download (ISO from spoofed websites); Exploit Vulnerability (CVE-2021-1879); Website Equipping (spoofed independent websites).","EnvyScout, BoomBox, NativeZone, VaporRage, Cobalt Strike Beacon, Constant Contact.","Government and defense agencies, Corporations and Businesses, Healthcare, Education and research institutions, Critical infrastructure."
2021-06-10,Big airline heist_ APT41 likely behind massive supply chain attack,,https://github.com/CyberMonitor/APT_CyberCriminal_Campagin_Collections/raw/master/2021/2021.06.10.Big_airline_heist/Big%20airline%20heist_%20APT41%20likely%20behind%20massive%20supply%20chain%20attack.pdf,APT41,India,Not mentioned,Not mentioned,"hashdump, mimikatz, BadPotato, BadPotatoNet4.exe, Cobalt Strike framework",Corporations and Businesses
2021-06-11,Story of the 'Phisherman' -Dissecting Phishing Techniques of CloudDragon APT (slides),,https://conference.hitb.org/hitbsecconf2021ams/materials/D2T1%20-%20The%20Phishermen%20-%20Dissecting%20Phishing%20Techniques%20of%20CloudDragon%20APT%20-%20Linda%20Kuo%20&Zih-Cing%20Liao%20.pdf,CloudDragon,U.S. and Korea,Not mentioned,Phishing,"DOKKAEBI, BabyShark, Banshee, KGH Spyware Suite.","Government and defense agencies, Individuals."
2021-07-13,ASEC_REPORT_vol.103_ENG,,https://github.com/CyberMonitor/APT_CyberCriminal_Campagin_Collections/raw/master/Report/AhnLab/ASEC_REPORT_vol.103_ENG.pdf,TA505 group,Korean companies,Not mentioned,Phishing,"SdbBot, FlawedAmmyy, Cobalt Strike, CLOP ransomware.","Corporations and Businesses, Education and research institutions, Government and defense agencies, Healthcare, Energy and utilities."
2021-07-28,I Knew You Were Trouble_ TA456 Targets Defense Contractor with Alluring Social Media Persona _ Proofpoint US,,https://github.com/CyberMonitor/APT_CyberCriminal_Campagin_Collections/raw/master/2021/2021.07.28.TA456/I%20Knew%20You%20Were%20Trouble_%20TA456%20Targets%20Defense%20Contractor%20with%20Alluring%20Social%20Media%20Persona%20_%20Proofpoint%20US.pdf,"TA456, Tortoiseshell",U.S.,Not mentioned,"SpearPhishing, Social Engineering, Malicious Documents","LEMPO, Liderc, Syskit, Collaboration Data Objects (CDO), Visual Basic Script (VBS), WMIC.",Government and defense agencies
2021-08-17,volexity.com-North Korean APT InkySquid Infects Victims Using Browser Exploits,,https://github.com/CyberMonitor/APT_CyberCriminal_Campagin_Collections/raw/master/2021/2021.08.17.NK_APT_InkySquid/volexity.com-North%20Korean%20APT%20InkySquid%20Infects%20Victims%20Using%20Browser%20Exploits.pdf,InkySquid,Not mentioned,Not mentioned.,Exploit Vulnerability,"BLUELIGHT, Cobalt Strike, Microsoft Graph API",Not mentioned
2021-09-02,North Korean Cyberattacks  A Dangerous and Evolving Threat 2,,https://github.com/CyberMonitor/APT_CyberCriminal_Campagin_Collections/raw/master/Report/North%20Korean%20Cyberattacks%20%20A%20Dangerous%20and%20Evolving%20Threat%202.pdf,Lazarus,"Singapore, South Korea, the U.K., the United States, Philippines, Taiwan, Turkey, Chile, and Vietnam.",Not mentioned,"SpearPhishing, Social Engineering","Bankshot Implant, Trojan Manuscript","Government and defense agencies, Corporations and Businesses, Financial institutions, Healthcare, Energy and utilities, Education and research institutions, Media and entertainment companies, Critical infrastructure."
2021-09-23,FamousSparrow_ A suspicious hotel guest _ WeLiveSecurity,,https://github.com/CyberMonitor/APT_CyberCriminal_Campagin_Collections/raw/master/2021/2021.09.23.FamousSparrow/FamousSparrow_%20A%C2%A0suspicious%20hotel%20guest%20_%20WeLiveSecurity.pdf,FamousSparrow,"Brazil, Burkina Faso, South Africa, Canada, Israel, France, Guatemala, Lithuania, Saudi Arabia, Taiwan, Thailand, United Kingdom",FALSE,Exploit Vulnerability,"Motnug, Metasploit, Mimikatz, ProcDump, Nbtscan, SparrowDoor, and Windows Command Shell (cmd.exe).","Government and defense agencies, Corporations and Businesses, Non-Governmental Organizations (NGOs) and Nonprofits"
2021-09-27,FoggyWeb_ Targeted NOBELIUM malware leads to persistent backdoor _ Microsoft Security Blog,,https://github.com/CyberMonitor/APT_CyberCriminal_Campagin_Collections/raw/master/2021/2021.09.27.FoggyWeb/FoggyWeb_%20Targeted%20NOBELIUM%20malware%20leads%20to%20persistent%20backdoor%20_%20Microsoft%20Security%20Blog.pdf,NOBELIUM,Not mentioned,Not mentioned,Not mentioned.,"FoggyWeb, SUNBURST backdoor, TEARDROP, GoldMax, GoldFinder, Sibot, EnvyScout, BoomBox, NativeZone, VaporRage, .NET assembly, Common Language Runtime (CLR).",Not mentioned
